{"confusion_matrix_order":["api_interface_modified","dependency_upgraded","compatibility_checked","ci_failed","bug_fixed","integration_test_passed","review_approved","deployed","rolled_back"],"error_analysis_by_seed":{"20261021":{"prefix_length_bands":{"count":9360,"examples":[],"groups":{"long":3599,"medium":3332,"short":2429}},"semantic_categories":{"count":9360,"examples":[],"groups":{"deployment_rollback_ambiguity":{"count":70,"examples":[{"confidence_margin":0.35513763375704305,"example_key":"seq-003978:11","predicted":"rolled_back","prefix":["api_interface_modified","compatibility_checked","compatibility_checked","bug_fixed","integration_test_passed","compatibility_checked","ci_failed","ci_failed","review_approved","deployed","deployed"],"prefix_length_band":"long","target":"deployed"},{"confidence_margin":0.30079921579013286,"example_key":"seq-009724:13","predicted":"rolled_back","prefix":["api_interface_modified","compatibility_checked","integration_test_passed","deployed","ci_failed","bug_fixed","bug_fixed","ci_failed","ci_failed","bug_fixed","ci_failed","review_approved","deployed"],"prefix_length_band":"long","target":"deployed"},{"confidence_margin":0.29826886931730534,"example_key":"seq-008522:10","predicted":"rolled_back","prefix":["api_interface_modified","compatibility_checked","compatibility_checked","integration_test_passed","review_approved","api_interface_modified","ci_failed","compatibility_checked","integration_test_passed","deployed"],"prefix_length_band":"long","target":"deployed"},{"confidence_margin":0.29765385569693287,"example_key":"seq-007944:12","predicted":"rolled_back","prefix":["api_interface_modified","ci_failed","compatibility_checked","ci_failed","bug_fixed","bug_fixed","compatibility_checked","ci_failed","bug_fixed","review_approved","integration_test_passed","deployed"],"prefix_length_band":"long","target":"deployed"},{"confidence_margin":0.2970367267098892,"example_key":"seq-004616:13","predicted":"rolled_back","prefix":["api_interface_modified","ci_failed","dependency_upgraded","bug_fixed","ci_failed","api_interface_modified","integration_test_passed","bug_fixed","review_approved","compatibility_checked","compatibility_checked","review_approved","deployed"],"prefix_length_band":"long","target":"deployed"}]},"other":{"count":3415,"examples":[{"confidence_margin":0.7625860680641129,"example_key":"seq-006116:7","predicted":"deployed","prefix":["api_interface_modified","compatibility_checked","integration_test_passed","compatibility_checked","integration_test_passed","compatibility_checked","review_approved"],"prefix_length_band":"medium","target":"ci_failed"},{"confidence_margin":0.7620442734039018,"example_key":"seq-000070:13","predicted":"deployed","prefix":["dependency_upgraded","compatibility_checked","integration_test_passed","compatibility_checked","compatibility_checked","ci_failed","bug_fixed","compatibility_checked","bug_fixed","integration_test_passed","deployed","bug_fixed","review_approved"],"prefix_length_band":"long","target":"compatibility_checked"},{"confidence_margin":0.7411850197135517,"example_key":"seq-007368:7","predicted":"deployed","prefix":["api_interface_modified","compatibility_checked","review_approved","compatibility_checked","review_approved","compatibility_checked","review_approved"],"prefix_length_band":"medium","target":"ci_failed"},{"confidence_margin":0.733690610632498,"example_key":"seq-009785:8","predicted":"deployed","prefix":["dependency_upgraded","compatibility_checked","integration_test_passed","compatibility_checked","integration_test_passed","compatibility_checked","integration_test_passed","review_approved"],"prefix_length_band":"long","target":"ci_failed"},{"confidence_margin":0.7320830264200976,"example_key":"seq-004775:13","predicted":"deployed","prefix":["dependency_upgraded","compatibility_checked","ci_failed","bug_fixed","compatibility_checked","ci_failed","bug_fixed","bug_fixed","compatibility_checked","integration_test_passed","deployed","bug_fixed","review_approved"],"prefix_length_band":"long","target":"api_interface_modified"}]},"post_failure_recovery":{"count":1205,"examples":[{"confidence_margin":0.6284172721676045,"example_key":"seq-001793:9","predicted":"deployed","prefix":["api_interface_modified","compatibility_checked","integration_test_passed","ci_failed","review_approved","bug_fixed","ci_failed","bug_fixed","review_approved"],"prefix_length_band":"long","target":"compatibility_checked"},{"confidence_margin":0.6235529723523388,"example_key":"seq-001402:8","predicted":"deployed","prefix":["dependency_upgraded","dependency_upgraded","integration_test_passed","compatibility_checked","integration_test_passed","ci_failed","compatibility_checked","review_approved"],"prefix_length_band":"long","target":"bug_fixed"},{"confidence_margin":0.5973854149722929,"example_key":"seq-008050:5","predicted":"bug_fixed","prefix":["dependency_upgraded","compatibility_checked","bug_fixed","compatibility_checked","ci_failed"],"prefix_length_band":"medium","target":"compatibility_checked"},{"confidence_margin":0.5780221208764673,"example_key":"seq-008943:13","predicted":"bug_fixed","prefix":["dependency_upgraded","compatibility_checked","ci_failed","api_interface_modified","compatibility_checked","bug_fixed","integration_test_passed","review_approved","integration_test_passed","review_approved","deployed","deployed","ci_failed"],"prefix_length_band":"long","target":"compatibility_checked"},{"confidence_margin":0.5761782838814679,"example_key":"seq-006391:9","predicted":"deployed","prefix":["api_interface_modified","api_interface_modified","compatibility_checked","integration_test_passed","review_approved","deployed","ci_failed","compatibility_checked","review_approved"],"prefix_length_band":"long","target":"bug_fixed"}]},"rare_target":{"count":102,"examples":[{"confidence_margin":0.3205118934791729,"example_key":"seq-003212:6","predicted":"bug_fixed","prefix":["api_interface_modified","ci_failed","bug_fixed","ci_failed","api_interface_modified","deployed"],"prefix_length_band":"medium","target":"rolled_back"},{"confidence_margin":0.23304717731140592,"example_key":"seq-001103:7","predicted":"bug_fixed","prefix":["api_interface_modified","integration_test_passed","review_approved","api_interface_modified","ci_failed","api_interface_modified","deployed"],"prefix_length_band":"medium","target":"rolled_back"},{"confidence_margin":0.13225345717202208,"example_key":"seq-006590:8","predicted":"review_approved","prefix":["api_interface_modified","integration_test_passed","review_approved","integration_test_passed","review_approved","integration_test_passed","review_approved","deployed"],"prefix_length_band":"long","target":"rolled_back"},{"confidence_margin":0.1297241927844736,"example_key":"seq-005004:5","predicted":"review_approved","prefix":["api_interface_modified","integration_test_passed","compatibility_checked","integration_test_passed","deployed"],"prefix_length_band":"medium","target":"rolled_back"},{"confidence_margin":0.12334392303208558,"example_key":"seq-003163:5","predicted":"api_interface_modified","prefix":["dependency_upgraded","api_interface_modified","compatibility_checked","review_approved","deployed"],"prefix_length_band":"medium","target":"rolled_back"}]},"readiness_ambiguity":{"count":4898,"examples":[{"confidence_margin":0.7483250298985731,"example_key":"seq-000413:7","predicted":"deployed","prefix":["api_interface_modified","compatibility_checked","integration_test_passed","compatibility_checked","integration_test_passed","compatibility_checked","review_approved"],"prefix_length_band":"medium","target":"integration_test_passed"},{"confidence_margin":0.7280559093627412,"example_key":"seq-009364:12","predicted":"deployed","prefix":["dependency_upgraded","api_interface_modified","compatibility_checked","integration_test_passed","compatibility_checked","bug_fixed","ci_failed","review_approved","integration_test_passed","bug_fixed","deployed","review_approved"],"prefix_length_band":"long","target":"integration_test_passed"},{"confidence_margin":0.7227217933282181,"example_key":"seq-007178:9","predicted":"deployed","prefix":["api_interface_modified","compatibility_checked","review_approved","ci_failed","compatibility_checked","integration_test_passed","bug_fixed","compatibility_checked","review_approved"],"prefix_length_band":"long","target":"review_approved"},{"confidence_margin":0.7058499762979878,"example_key":"seq-004813:7","predicted":"deployed","prefix":["dependency_upgraded","compatibility_checked","compatibility_checked","compatibility_checked","integration_test_passed","compatibility_checked","review_approved"],"prefix_length_band":"medium","target":"integration_test_passed"},{"confidence_margin":0.6964226579886119,"example_key":"seq-000101:13","predicted":"deployed","prefix":["api_interface_modified","compatibility_checked","ci_failed","bug_fixed","compatibility_checked","ci_failed","bug_fixed","compatibility_checked","compatibility_checked","bug_fixed","integration_test_passed","compatibility_checked","review_approved"],"prefix_length_band":"long","target":"integration_test_passed"}]}}},"true_predicted_pairs":{"count":9360,"examples":[],"groups":{"api_interface_modified->bug_fixed":170,"api_interface_modified->ci_failed":5,"api_interface_modified->compatibility_checked":293,"api_interface_modified->dependency_upgraded":0,"api_interface_modified->deployed":119,"api_interface_modified->integration_test_passed":0,"api_interface_modified->review_approved":27,"api_interface_modified->rolled_back":83,"bug_fixed->api_interface_modified":70,"bug_fixed->ci_failed":10,"bug_fixed->compatibility_checked":477,"bug_fixed->dependency_upgraded":0,"bug_fixed->deployed":74,"bug_fixed->integration_test_passed":485,"bug_fixed->review_approved":195,"bug_fixed->rolled_back":69,"ci_failed->api_interface_modified":88,"ci_failed->bug_fixed":376,"ci_failed->compatibility_checked":747,"ci_failed->dependency_upgraded":0,"ci_failed->deployed":1